{
  "InputDataConfig": "example-string",
  "OutputDataConfig": "example-string",
  "DataAccessRoleArn": "arn:aws:comprehend:us-east-1:123456789012:document-classifier/MyClassifier",
  "JobName": "example-name",
  "LanguageCode": "en",
  "ClientRequestToken": "example-string",
  "VolumeKmsKeyId": "example-string",
  "VpcConfig": "example-string",
  "Tags": "example-string"
}